{
  "id": 1046,
  "name": "Anomaly WE Vita",
  "author": "Rinnegatamante",
  "category": "port",
  "platform": "vita",
  "titleid": "ANOMALY01",
  "repo": "Rinnegatamante/anomaly-we_vita",
  "asset": "*.vpk",
  "prerelease": false,
  "icon": "1046-anomaly-we-vita.png",
  "description": "This is a wrapper/port of Anomaly: Warzone Earth HD for PSVITA.\nThe port works by loading the official Android ARMv6 executable in memory, resolving its imports with native functions and patching it in order to properly run. By doing so, it's basically as if we emulate a minimalist Android environment in which we run natively the executable as it is.",
  "requirements": "- libshacccg.suprx\n- kubridge.skprx\n- fd_fix.skprx OR repatch_ex.skprx\n- Game Data Files: Android",
  "screenshots": [],
  "trophies": false,
  "ai": false
}
