{
  "id": 366,
  "name": "Cannonball",
  "author": "rsn8887",
  "category": "port",
  "platform": "vita",
  "titleid": "CANNONBAL",
  "repo": "rsn8887/cannonball",
  "asset": "*.vpk",
  "prerelease": false,
  "icon": "0366-cannonball.png",
  "description": "PSVita port of Cannonball, an enhanced Outrun engine by djyt.",
  "requirements": "- Game Data Files",
  "screenshots": [],
  "trophies": false,
  "ai": false,
  "data": "https://www.rinnegatamante.eu/files/vitadb/cannonball.zip"
}
