{
  "id": 1315,
  "name": "Toon Rescue Vita",
  "author": "Rinnegatamante",
  "category": "port",
  "platform": "vita",
  "titleid": "TOONCUBE1",
  "repo": "Rinnegatamante/toon-rescue-vita",
  "asset": "*.vpk",
  "prerelease": false,
  "icon": "1315-toon-rescue-vita.png",
  "description": "This is a wrapper/port of Toon Rescue: Cube Blast Match for the PS Vita.\nThe port works by loading the official Android ARMv7 executable in memory, resolving its imports with native functions and patching it in order to properly run. By doing so, it's basically as if we emulate a minimalist Android environment in which we run natively the executable as it is.",
  "requirements": "- libshacccg.suprx\n- kubridge.skprx\n- Game Data Files: Android",
  "screenshots": [],
  "trophies": false,
  "ai": false
}
