{
  "id": 156,
  "name": "Flood It!",
  "author": "notnotme",
  "category": "game",
  "platform": "vita",
  "titleid": "FLDT00001",
  "repo": "notnotme/NotEngine_PSV",
  "asset": "*.vpk",
  "prerelease": false,
  "icon": "0156-flood-it.png",
  "description": "Small game powered by NotEngine. Clone of Flood It!",
  "requirements": "",
  "screenshots": [],
  "trophies": false,
  "ai": false
}
