{
  "id": 1172,
  "name": "OpenXcom Extended",
  "author": "Northfear",
  "category": "port",
  "platform": "vita",
  "titleid": "OXCE00001",
  "repo": "Northfear/OpenXcom-vita",
  "asset": "*.vpk",
  "prerelease": false,
  "icon": "1172-openxcom-extended.png",
  "description": "Port of OpenXcom Extended for PSVITA.\nOpenXcom Extended is an improved version of OpenXcom.",
  "requirements": "- Game Data Files: PC",
  "screenshots": [],
  "trophies": false,
  "ai": false,
  "data": "https://www.rinnegatamante.eu/files/vitadb/oxce-data.zip"
}
