{
  "id": 830,
  "name": "uMario Vita",
  "author": "Hammerill",
  "category": "port",
  "platform": "vita",
  "titleid": "HMRL00002",
  "repo": "Hammerill/uMario_Vita",
  "asset": "*.vpk",
  "prerelease": false,
  "icon": "0830-umario-vita.png",
  "description": "Port of uMario for PSVITA. uMario is a recreation of Super Mario Bros with widescreen patch and some added options.",
  "requirements": "",
  "screenshots": [],
  "trophies": false,
  "ai": false
}
