{
  "id": 1245,
  "name": "SF1MR Vita",
  "author": "AnasHalideen",
  "category": "port",
  "platform": "vita",
  "titleid": "SFMR10000",
  "repo": "anas-halid/SF1MR-VITA",
  "asset": "*.vpk",
  "prerelease": false,
  "icon": "1245-sf1mr-vita.png",
  "description": "A PS Vita Port of the Popular Mugen Remake of Street Fighter One (SF1MR) using Dolmexica Infinite as the engine.\nStreet Fighter One M.U.G.E.N Remake. Another Mugen Street Fighter game. This time, it is a remake of original very first Street Fighter game, simply called Street Fighter 1, that is also known in home ports as Fighting Street.",
  "requirements": "",
  "screenshots": [],
  "trophies": false,
  "ai": false
}
