{
  "id": 574,
  "name": "MemoryGame",
  "author": "JJH",
  "category": "game",
  "platform": "vita",
  "titleid": "JJH000001",
  "repo": "JJH47E/MemoryGame",
  "asset": "*.vpk",
  "prerelease": false,
  "icon": "0574-memorygame.png",
  "description": "MemoryGame is a simple brain training game for the PS Vita inspired to the popular Simon Says game.",
  "requirements": "",
  "screenshots": [],
  "trophies": false,
  "ai": false
}
