{
  "id": 791,
  "name": "Dead Knight",
  "author": "rodentcat",
  "category": "port",
  "platform": "vita",
  "titleid": "DEADKNI01",
  "repo": "rodentcat/deadknight-vita-port",
  "asset": "*.vpk",
  "prerelease": false,
  "icon": "0791-dead-knight.png",
  "description": "Dead Knight - Pocket Edition is a downgrade version of the upcoming roguevania Dead Knight. Made for GBJam 4.",
  "requirements": "- Game Data Files: PC",
  "screenshots": [],
  "trophies": false,
  "ai": false
}
